{
  "artifact_class": "CANDIDATE_SLATE_STRUCTURE",
  "not_a_capital_instrument": true,
  "total_slots": 15,
  "horizon_distribution": {
    "short": 5,
    "medium": 5,
    "long": 5
  },
  "all_slots_populated": false,
  "fabrication_prohibited": true,
  "slots": [
    {
      "slot_id": "SLOT-01",
      "horizon_bucket": "short",
      "horizon_definition": "<=14 days",
      "status": "AWAITING_CANDIDATE_SELECTION",
      "subject": null,
      "primary_source": null,
      "evaluation_procedure": null,
      "benchmark": null,
      "standing_adversary_counter_thesis_risk": null,
      "note": "Placeholder only. No real-world candidate claim has been selected or fabricated for this slot. Populated only once the candidate/source-selection methodology (spec §4) is applied by the owner/research process against a named, ratified source list."
    },
    {
      "slot_id": "SLOT-02",
      "horizon_bucket": "short",
      "horizon_definition": "<=14 days",
      "status": "AWAITING_CANDIDATE_SELECTION",
      "subject": null,
      "primary_source": null,
      "evaluation_procedure": null,
      "benchmark": null,
      "standing_adversary_counter_thesis_risk": null,
      "note": "Placeholder only. No real-world candidate claim has been selected or fabricated for this slot. Populated only once the candidate/source-selection methodology (spec §4) is applied by the owner/research process against a named, ratified source list."
    },
    {
      "slot_id": "SLOT-03",
      "horizon_bucket": "short",
      "horizon_definition": "<=14 days",
      "status": "AWAITING_CANDIDATE_SELECTION",
      "subject": null,
      "primary_source": null,
      "evaluation_procedure": null,
      "benchmark": null,
      "standing_adversary_counter_thesis_risk": null,
      "note": "Placeholder only. No real-world candidate claim has been selected or fabricated for this slot. Populated only once the candidate/source-selection methodology (spec §4) is applied by the owner/research process against a named, ratified source list."
    },
    {
      "slot_id": "SLOT-04",
      "horizon_bucket": "short",
      "horizon_definition": "<=14 days",
      "status": "AWAITING_CANDIDATE_SELECTION",
      "subject": null,
      "primary_source": null,
      "evaluation_procedure": null,
      "benchmark": null,
      "standing_adversary_counter_thesis_risk": null,
      "note": "Placeholder only. No real-world candidate claim has been selected or fabricated for this slot. Populated only once the candidate/source-selection methodology (spec §4) is applied by the owner/research process against a named, ratified source list."
    },
    {
      "slot_id": "SLOT-05",
      "horizon_bucket": "short",
      "horizon_definition": "<=14 days",
      "status": "AWAITING_CANDIDATE_SELECTION",
      "subject": null,
      "primary_source": null,
      "evaluation_procedure": null,
      "benchmark": null,
      "standing_adversary_counter_thesis_risk": null,
      "note": "Placeholder only. No real-world candidate claim has been selected or fabricated for this slot. Populated only once the candidate/source-selection methodology (spec §4) is applied by the owner/research process against a named, ratified source list."
    },
    {
      "slot_id": "SLOT-06",
      "horizon_bucket": "medium",
      "horizon_definition": "15-45 days",
      "status": "AWAITING_CANDIDATE_SELECTION",
      "subject": null,
      "primary_source": null,
      "evaluation_procedure": null,
      "benchmark": null,
      "standing_adversary_counter_thesis_risk": null,
      "note": "Placeholder only. No real-world candidate claim has been selected or fabricated for this slot. Populated only once the candidate/source-selection methodology (spec §4) is applied by the owner/research process against a named, ratified source list."
    },
    {
      "slot_id": "SLOT-07",
      "horizon_bucket": "medium",
      "horizon_definition": "15-45 days",
      "status": "AWAITING_CANDIDATE_SELECTION",
      "subject": null,
      "primary_source": null,
      "evaluation_procedure": null,
      "benchmark": null,
      "standing_adversary_counter_thesis_risk": null,
      "note": "Placeholder only. No real-world candidate claim has been selected or fabricated for this slot. Populated only once the candidate/source-selection methodology (spec §4) is applied by the owner/research process against a named, ratified source list."
    },
    {
      "slot_id": "SLOT-08",
      "horizon_bucket": "medium",
      "horizon_definition": "15-45 days",
      "status": "AWAITING_CANDIDATE_SELECTION",
      "subject": null,
      "primary_source": null,
      "evaluation_procedure": null,
      "benchmark": null,
      "standing_adversary_counter_thesis_risk": null,
      "note": "Placeholder only. No real-world candidate claim has been selected or fabricated for this slot. Populated only once the candidate/source-selection methodology (spec §4) is applied by the owner/research process against a named, ratified source list."
    },
    {
      "slot_id": "SLOT-09",
      "horizon_bucket": "medium",
      "horizon_definition": "15-45 days",
      "status": "AWAITING_CANDIDATE_SELECTION",
      "subject": null,
      "primary_source": null,
      "evaluation_procedure": null,
      "benchmark": null,
      "standing_adversary_counter_thesis_risk": null,
      "note": "Placeholder only. No real-world candidate claim has been selected or fabricated for this slot. Populated only once the candidate/source-selection methodology (spec §4) is applied by the owner/research process against a named, ratified source list."
    },
    {
      "slot_id": "SLOT-10",
      "horizon_bucket": "medium",
      "horizon_definition": "15-45 days",
      "status": "AWAITING_CANDIDATE_SELECTION",
      "subject": null,
      "primary_source": null,
      "evaluation_procedure": null,
      "benchmark": null,
      "standing_adversary_counter_thesis_risk": null,
      "note": "Placeholder only. No real-world candidate claim has been selected or fabricated for this slot. Populated only once the candidate/source-selection methodology (spec §4) is applied by the owner/research process against a named, ratified source list."
    },
    {
      "slot_id": "SLOT-11",
      "horizon_bucket": "long",
      "horizon_definition": "46-90 days",
      "status": "AWAITING_CANDIDATE_SELECTION",
      "subject": null,
      "primary_source": null,
      "evaluation_procedure": null,
      "benchmark": null,
      "standing_adversary_counter_thesis_risk": null,
      "note": "Placeholder only. No real-world candidate claim has been selected or fabricated for this slot. Populated only once the candidate/source-selection methodology (spec §4) is applied by the owner/research process against a named, ratified source list."
    },
    {
      "slot_id": "SLOT-12",
      "horizon_bucket": "long",
      "horizon_definition": "46-90 days",
      "status": "AWAITING_CANDIDATE_SELECTION",
      "subject": null,
      "primary_source": null,
      "evaluation_procedure": null,
      "benchmark": null,
      "standing_adversary_counter_thesis_risk": null,
      "note": "Placeholder only. No real-world candidate claim has been selected or fabricated for this slot. Populated only once the candidate/source-selection methodology (spec §4) is applied by the owner/research process against a named, ratified source list."
    },
    {
      "slot_id": "SLOT-13",
      "horizon_bucket": "long",
      "horizon_definition": "46-90 days",
      "status": "AWAITING_CANDIDATE_SELECTION",
      "subject": null,
      "primary_source": null,
      "evaluation_procedure": null,
      "benchmark": null,
      "standing_adversary_counter_thesis_risk": null,
      "note": "Placeholder only. No real-world candidate claim has been selected or fabricated for this slot. Populated only once the candidate/source-selection methodology (spec §4) is applied by the owner/research process against a named, ratified source list."
    },
    {
      "slot_id": "SLOT-14",
      "horizon_bucket": "long",
      "horizon_definition": "46-90 days",
      "status": "AWAITING_CANDIDATE_SELECTION",
      "subject": null,
      "primary_source": null,
      "evaluation_procedure": null,
      "benchmark": null,
      "standing_adversary_counter_thesis_risk": null,
      "note": "Placeholder only. No real-world candidate claim has been selected or fabricated for this slot. Populated only once the candidate/source-selection methodology (spec §4) is applied by the owner/research process against a named, ratified source list."
    },
    {
      "slot_id": "SLOT-15",
      "horizon_bucket": "long",
      "horizon_definition": "46-90 days",
      "status": "AWAITING_CANDIDATE_SELECTION",
      "subject": null,
      "primary_source": null,
      "evaluation_procedure": null,
      "benchmark": null,
      "standing_adversary_counter_thesis_risk": null,
      "note": "Placeholder only. No real-world candidate claim has been selected or fabricated for this slot. Populated only once the candidate/source-selection methodology (spec §4) is applied by the owner/research process against a named, ratified source list."
    }
  ]
}
